Chemical Property,A,R,N,D,C,Q,E,G,H,I,L,K,M,F,P,S,T,W,Y,V
alpha-CH chemical shifts (ANDN920101),4.35,4.38,4.75,4.76,4.65,4.37,4.29,3.97,4.63,3.95,4.17,4.36,4.52,4.66,4.44,4.5,4.35,4.7,4.6,3.95
Hydrophobicity index (ARGP820101),0.61,0.6,0.06,0.46,1.07,0,0.47,0.07,0.61,2.22,1.53,1.15,1.18,2.02,1.95,0.05,0.05,2.65,1.88,1.32
Signal sequence helical potential (ARGP820102),1.18,0.2,0.23,0.05,1.89,0.72,0.11,0.49,0.31,1.45,3.23,0.06,2.67,1.96,0.76,0.97,0.84,0.77,0.39,1.08
Membrane-buried preference parameters (ARGP820103),1.56,0.45,0.27,0.14,1.23,0.51,0.23,0.62,0.29,1.67,2.93,0.15,2.96,2.03,0.76,0.81,0.91,1.08,0.68,1.14
Conformational parameter of inner helix (BEGF750101),1,0.52,0.35,0.44,0.06,0.44,0.73,0.35,0.6,0.73,1,0.6,1,0.6,0.06,0.35,0.44,0.73,0.44,0.82
Conformational parameter of beta-structure (BEGF750102),0.77,0.72,0.55,0.65,0.65,0.72,0.55,0.65,0.83,0.98,0.83,0.55,0.98,0.98,0.55,0.55,0.83,0.77,0.83,0.98
Conformational parameter of beta-turn (BEGF750103),0.37,0.84,0.97,0.97,0.84,0.64,0.53,0.97,0.75,0.37,0.53,0.75,0.64,0.53,0.97,0.84,0.75,0.97,0.84,0.37
Average flexibility indices (BHAR880101),0.357,0.529,0.463,0.511,0.346,0.493,0.497,0.544,0.323,0.462,0.365,0.466,0.295,0.314,0.509,0.507,0.444,0.305,0.42,0.386
Residue volume (BIGC670101),52.6,109.1,75.7,68.4,68.3,89.7,84.7,36.3,91.9,102,102,105.1,97.7,113.9,73.6,54.9,71.2,135.4,116.2,85.1
Information value for accessibility; average fraction 35% (BIOV880101),16,-70,-74,-78,168,-73,-106,-13,50,151,145,-141,124,189,-20,-70,-38,145,53,123
Information value for accessibility; average fraction 23% (BIOV880102),44,-68,-72,-91,90,-117,-139,-8,47,100,108,-188,121,148,-36,-60,-54,163,22,117
Retention coefficient in TFA (BROC820101),7.3,-3.6,-5.7,-2.9,-9.2,-0.3,-7.1,-1.2,-2.1,6.6,20,-3.7,5.6,19.2,5.1,-4.1,0.8,16.3,5.9,3.5
Retention coefficient in HFBA (BROC820102),3.9,3.2,-2.8,-2.8,-14.3,1.8,-7.5,-2.3,2,11,15,-2.5,4.1,14.7,5.6,-3.5,1.1,17.8,3.8,2.1
Transfer free energy to surface (BULH740101),-0.2,-0.12,0.08,-0.2,-0.45,0.16,-0.3,0,-0.12,-2.26,-2.46,-0.35,-1.47,-2.33,-0.98,-0.39,-0.52,-2.01,-2.24,-1.56
Apparent partial specific volume (BULH740102),0.691,0.728,0.596,0.558,0.624,0.649,0.632,0.592,0.646,0.809,0.842,0.767,0.709,0.756,0.73,0.594,0.655,0.743,0.743,0.777
alpha-NH chemical shifts (BUNA790101),8.249,8.274,8.747,8.41,8.312,8.411,8.368,8.391,8.415,8.195,8.423,8.408,8.418,8.228,0,8.38,8.236,8.094,8.183,8.436
alpha-CH chemical shifts (BUNA790102),4.349,4.396,4.755,4.765,4.686,4.373,4.295,3.972,4.63,4.224,4.385,4.358,4.513,4.663,4.471,4.498,4.346,4.702,4.604,4.184
Spin-spin coupling constants 3JHalpha-NH (BUNA790103),6.5,6.9,7.5,7,7.7,6,7,5.6,8,7,6.5,6.5,0,9.4,0,6.5,6.9,0,6.8,7
Normalized frequency of alpha-helix (BURA740101),0.486,0.262,0.193,0.288,0.2,0.418,0.538,0.12,0.4,0.37,0.42,0.402,0.417,0.318,0.208,0.2,0.272,0.462,0.161,0.379
Normalized frequency of extended structure (BURA740102),0.288,0.362,0.229,0.271,0.533,0.327,0.262,0.312,0.2,0.411,0.4,0.265,0.375,0.318,0.34,0.354,0.388,0.231,0.429,0.495
Steric parameter (CHAM810101),0.52,0.68,0.76,0.76,0.62,0.68,0.68,0,0.7,1.02,0.98,0.68,0.78,0.7,0.36,0.53,0.5,0.7,0.7,0.76
Polarizability parameter (CHAM820101),0.046,0.291,0.134,0.105,0.128,0.18,0.151,0,0.23,0.186,0.186,0.219,0.221,0.29,0.131,0.062,0.108,0.409,0.298,0.14
"Free energy of solution in water, kcal/mole (CHAM820102)",-0.368,-1.03,0,2.06,4.53,0.731,1.77,-0.525,0,0.791,1.07,0,0.656,1.06,-2.24,-0.524,0,1.6,4.91,0.401
The Chou-Fasman parameter of the coil conformation (CHAM830101),0.71,1.06,1.37,1.21,1.19,0.87,0.84,1.52,1.07,0.66,0.69,0.99,0.59,0.71,1.61,1.34,1.08,0.76,1.07,0.63
A parameter defined from the residuals obtained from the best correlation of the Chou-Fasman parameter of beta-sheet (CHAM830102),-0.118,0.124,0.289,0.048,0.083,-0.105,-0.245,0.104,0.138,0.23,-0.052,0.032,-0.258,0.015,0,0.225,0.166,0.158,0.094,0.513
The number of atoms in the side chain labelled 1+1 (CHAM830103),0,1,1,1,1,1,1,0,1,2,1,1,1,1,0,1,2,1,1,2
The number of atoms in the side chain labelled 2+1 (CHAM830104),0,1,1,1,0,1,1,0,1,1,2,1,1,1,0,0,0,1,1,0
The number of atoms in the side chain labelled 3+1 (CHAM830105),0,1,0,0,0,1,1,0,1,0,0,1,1,1,0,0,0,1.5,1,0
The number of bonds in the longest chain (CHAM830106),0,5,2,2,1,3,3,0,3,2,2,4,3,4,0,1,1,5,5,1
A parameter of charge transfer capability (CHAM830107),0,0,1,1,0,0,1,1,0,0,0,0,0,0,0,0,0,0,0,0
A parameter of charge transfer donor capability (CHAM830108),0,1,1,0,1,1,0,0,1,0,0,1,1,1,0,0,0,1,1,0
Average volume of buried residue (CHOC750101),91.5,202,135.2,124.5,117.7,161.1,155.1,66.4,167.3,168.8,167.9,171.3,170.8,203.4,129.3,99.1,122.1,237.6,203.6,141.7
Residue accessible surface area in tripeptide (CHOC760101),115,225,160,150,135,180,190,75,195,175,170,200,185,210,145,115,140,255,230,155
Residue accessible surface area in folded protein (CHOC760102),25,90,63,50,19,71,49,23,43,18,23,97,31,24,50,44,47,32,60,18
Proportion of residues 95% buried (CHOC760103),0.38,0.01,0.12,0.15,0.45,0.07,0.18,0.36,0.17,0.6,0.45,0.03,0.4,0.5,0.18,0.22,0.23,0.27,0.15,0.54
Proportion of residues 100% buried (CHOC760104),0.2,0,0.03,0.04,0.22,0.01,0.03,0.18,0.02,0.19,0.16,0,0.11,0.14,0.04,0.08,0.08,0.04,0.03,0.18
Normalized frequency of beta-turn (CHOP780101),0.66,0.95,1.56,1.46,1.19,0.98,0.74,1.56,0.95,0.47,0.59,1.01,0.6,0.6,1.52,1.43,0.96,0.96,1.14,0.5
Normalized frequency of alpha-helix (CHOP780201),1.42,0.98,0.67,1.01,0.7,1.11,1.51,0.57,1,1.08,1.21,1.16,1.45,1.13,0.57,0.77,0.83,1.08,0.69,1.06
Normalized frequency of beta-sheet (CHOP780202),0.83,0.93,0.89,0.54,1.19,1.1,0.37,0.75,0.87,1.6,1.3,0.74,1.05,1.38,0.55,0.75,1.19,1.37,1.47,1.7
Normalized frequency of beta-turn (CHOP780203),0.74,1.01,1.46,1.52,0.96,0.96,0.95,1.56,0.95,0.47,0.5,1.19,0.6,0.66,1.56,1.43,0.98,0.6,1.14,0.59
Normalized frequency of N-terminal helix (CHOP780204),1.29,0.44,0.81,2.02,0.66,1.22,2.44,0.76,0.73,0.67,0.58,0.66,0.71,0.61,2.01,0.74,1.08,1.47,0.68,0.61
Normalized frequency of C-terminal helix (CHOP780205),1.2,1.25,0.59,0.61,1.11,1.22,1.24,0.42,1.77,0.98,1.13,1.83,1.57,1.1,0,0.96,0.75,0.4,0.73,1.25
Normalized frequency of N-terminal non helical region (CHOP780206),0.7,0.34,1.42,0.98,0.65,0.75,1.04,1.41,1.22,0.78,0.85,1.01,0.83,0.93,1.1,1.55,1.09,0.62,0.99,0.75
Normalized frequency of C-terminal non helical region (CHOP780207),0.52,1.24,1.64,1.06,0.94,0.7,0.59,1.64,1.86,0.87,0.84,1.49,0.52,1.04,1.58,0.93,0.86,0.16,0.96,0.32
Normalized frequency of N-terminal beta-sheet (CHOP780208),0.86,0.9,0.66,0.38,0.87,1.65,0.35,0.63,0.54,1.94,1.3,1,1.43,1.5,0.66,0.63,1.17,1.49,1.07,1.69
Normalized frequency of C-terminal beta-sheet (CHOP780209),0.75,0.9,1.21,0.85,1.11,0.65,0.55,0.74,0.9,1.35,1.27,0.74,0.95,1.5,0.4,0.79,0.75,1.19,1.96,1.79
Normalized frequency of N-terminal non beta region (CHOP780210),0.67,0.89,1.86,1.39,1.34,1.09,0.92,1.46,0.78,0.59,0.46,1.09,0.52,0.3,1.58,1.41,1.09,0.48,1.23,0.42
Normalized frequency of C-terminal non beta region (CHOP780211),0.74,1.05,1.13,1.32,0.53,0.77,0.85,1.68,0.96,0.53,0.59,0.82,0.85,0.44,1.69,1.49,1.16,1.59,1.01,0.59
Frequency of the 1st residue in turn (CHOP780212),0.06,0.07,0.161,0.147,0.149,0.074,0.056,0.102,0.14,0.043,0.061,0.055,0.068,0.059,0.102,0.12,0.086,0.077,0.082,0.062
Frequency of the 2nd residue in turn (CHOP780213),0.076,0.106,0.083,0.11,0.053,0.098,0.06,0.085,0.047,0.034,0.025,0.115,0.082,0.041,0.301,0.139,0.108,0.013,0.065,0.048
Frequency of the 3rd residue in turn (CHOP780214),0.035,0.099,0.191,0.179,0.117,0.037,0.077,0.19,0.093,0.013,0.036,0.072,0.014,0.065,0.034,0.125,0.065,0.064,0.114,0.028
Frequency of the 4th residue in turn (CHOP780215),0.058,0.085,0.091,0.081,0.128,0.098,0.064,0.152,0.054,0.056,0.07,0.095,0.055,0.065,0.068,0.106,0.079,0.167,0.125,0.053
Normalized frequency of the 2nd and 3rd residues in turn (CHOP780216),0.64,1.05,1.56,1.61,0.92,0.84,0.8,1.63,0.77,0.29,0.36,1.13,0.51,0.62,2.04,1.52,0.98,0.48,1.08,0.43
Normalized hydrophobicity scales for alpha-proteins (CIDH920101),-0.45,-0.24,-0.2,-1.52,0.79,-0.99,-0.8,-1,1.07,0.76,1.29,-0.36,1.37,1.48,-0.12,-0.98,-0.7,1.38,1.49,1.26
Normalized hydrophobicity scales for beta-proteins (CIDH920102),-0.08,-0.09,-0.7,-0.71,0.76,-0.4,-1.31,-0.84,0.43,1.39,1.24,-0.09,1.27,1.53,-0.01,-0.93,-0.59,2.25,1.53,1.09
Normalized hydrophobicity scales for alpha+beta-proteins (CIDH920103),0.36,-0.52,-0.9,-1.09,0.7,-1.05,-0.83,-0.82,0.16,2.17,1.18,-0.56,1.21,1.01,-0.06,-0.6,-1.2,1.31,1.05,1.21
Normalized hydrophobicity scales for alpha/beta-proteins (CIDH920104),0.17,-0.7,-0.9,-1.05,1.24,-1.2,-1.19,-0.57,-0.25,2.06,0.96,-0.62,0.6,1.29,-0.21,-0.83,-0.62,1.51,0.66,1.21
Normalized average hydrophobicity scales (CIDH920105),0.02,-0.42,-0.77,-1.04,0.77,-1.1,-1.14,-0.8,0.26,1.81,1.14,-0.41,1,1.35,-0.09,-0.97,-0.77,1.71,1.11,1.13
Partial specific volume (COHE430101),0.75,0.7,0.61,0.6,0.61,0.67,0.66,0.64,0.67,0.9,0.9,0.82,0.75,0.77,0.76,0.68,0.7,0.74,0.71,0.86
Normalized frequency of middle helix (CRAJ730101),1.33,0.79,0.72,0.97,0.93,1.42,1.66,0.58,1.49,0.99,1.29,1.03,1.4,1.15,0.49,0.83,0.94,1.33,0.49,0.96
Normalized frequency of beta-sheet (CRAJ730102),1,0.74,0.75,0.89,0.99,0.87,0.37,0.56,0.36,1.75,1.53,1.18,1.4,1.26,0.36,0.65,1.15,0.84,1.41,1.61
Normalized frequency of turn (CRAJ730103),0.6,0.79,1.42,1.24,1.29,0.92,0.64,1.38,0.95,0.67,0.7,1.1,0.67,1.05,1.47,1.26,1.05,1.23,1.35,0.48
Size (DAWD720101),2.5,7.5,5,2.5,3,6,5,0.5,6,5.5,5.5,7,6,6.5,5.5,3,5,7,7,5
Amino acid composition (DAYM780101),8.6,4.9,4.3,5.5,2.9,3.9,6,8.4,2,4.5,7.4,6.6,1.7,3.6,5.2,7,6.1,1.3,3.4,6.6
Relative mutability (DAYM780201),100,65,134,106,20,93,102,49,66,96,40,56,94,41,56,120,97,18,41,74
Membrane preference for cytochrome b: MPH89 (DESM900101),1.56,0.59,0.51,0.23,1.8,0.39,0.19,1.03,1,1.27,1.38,0.15,1.93,1.42,0.27,0.96,1.11,0.91,1.1,1.58
Average membrane preference: AMP07 (DESM900102),1.26,0.38,0.59,0.27,1.6,0.39,0.23,1.08,1,1.44,1.36,0.33,1.52,1.46,0.54,0.98,1.01,1.06,0.89,1.33
Consensus normalized hydrophobicity scale (EISD840101),0.25,-1.76,-0.64,-0.72,0.04,-0.69,-0.62,0.16,-0.4,0.73,0.53,-1.1,0.26,0.61,-0.07,-0.26,-0.18,0.37,0.02,0.54
Solvation free energy (EISD860101),0.67,-2.1,-0.6,-1.2,0.38,-0.22,-0.76,0,0.64,1.9,1.9,-0.57,2.4,2.3,1.2,0.01,0.52,2.6,1.6,1.5
Atom-based hydrophobic moment (EISD860102),0,10,1.3,1.9,0.17,1.9,3,0,0.99,1.2,1,5.7,1.9,1.1,0.18,0.73,1.5,1.6,1.8,0.48
Direction of hydrophobic moment (EISD860103),0,-0.96,-0.86,-0.98,0.76,-1,-0.89,0,-0.75,0.99,0.89,-0.99,0.94,0.92,0.22,-0.67,0.09,0.67,-0.93,0.84
Molecular weight (FASG760101),89.09,174.2,132.12,133.1,121.15,146.15,147.13,75.07,155.16,131.17,131.17,146.19,149.21,165.19,115.13,105.09,119.12,204.24,181.19,117.15
Melting point (FASG760102),297,238,236,270,178,185,249,290,277,284,337,224,283,284,222,228,253,282,344,293
Optical rotation (FASG760103),1.8,12.5,-5.6,5.05,-16.5,6.3,12,0,-38.5,12.4,-11,14.6,-10,-34.5,-86.2,-7.5,-28,-33.7,-10,5.63
pK-N (FASG760104),9.69,8.99,8.8,9.6,8.35,9.13,9.67,9.78,9.17,9.68,9.6,9.18,9.21,9.18,10.64,9.21,9.1,9.44,9.11,9.62
pK-C (FASG760105),2.34,1.82,2.02,1.88,1.92,2.17,2.1,2.35,1.82,2.36,2.36,2.16,2.28,2.16,1.95,2.19,2.09,2.43,2.2,2.32
Hydrophobic parameter pi (FAUJ830101),0.31,-1.01,-0.6,-0.77,1.54,-0.22,-0.64,0,0.13,1.8,1.7,-0.99,1.23,1.79,0.72,-0.04,0.26,2.25,0.96,1.22
Graph shape index (FAUJ880101),1.28,2.34,1.6,1.6,1.77,1.56,1.56,0,2.99,4.19,2.59,1.89,2.35,2.94,2.67,1.31,3.03,3.21,2.94,3.67
Smoothed upsilon steric parameter (FAUJ880102),0.53,0.69,0.58,0.59,0.66,0.71,0.72,0,0.64,0.96,0.92,0.78,0.77,0.71,0,0.55,0.63,0.84,0.71,0.89
Normalized van der Waals volume (FAUJ880103),1,6.13,2.95,2.78,2.43,3.95,3.78,0,4.66,4,4,4.77,4.43,5.89,2.72,1.6,2.6,8.08,6.47,3
STERIMOL length of the side chain (FAUJ880104),2.87,7.82,4.58,4.74,4.47,6.11,5.97,2.06,5.23,4.92,4.92,6.89,6.36,4.62,4.11,3.97,4.11,7.68,4.73,4.11
STERIMOL minimum width of the side chain (FAUJ880105),1.52,1.52,1.52,1.52,1.52,1.52,1.52,1,1.52,1.9,1.52,1.52,1.52,1.52,1.52,1.52,1.73,1.52,1.52,1.9
STERIMOL maximum width of the side chain (FAUJ880106),2.04,6.24,4.37,3.78,3.41,3.53,3.31,1,5.66,3.49,4.45,4.87,4.8,6.02,4.31,2.7,3.17,5.9,6.72,3.17
N.m.r. chemical shift of alpha-carbon (FAUJ880107),7.3,11.1,8,9.2,14.4,10.6,11.4,0,10.2,16.1,10.1,10.9,10.4,13.9,17.8,13.1,16.7,13.2,13.9,17.2
Localized electrical effect (FAUJ880108),-0.01,0.04,0.06,0.15,0.12,0.05,0.07,0,0.08,-0.01,-0.01,0,0.04,0.03,0,0.11,0.04,0,0.03,0.01
Number of hydrogen bond donors (FAUJ880109),0,4,2,1,0,2,1,0,1,0,0,2,0,0,0,1,1,1,1,0
Number of full nonbonding orbitals (FAUJ880110),0,3,3,4,0,3,4,0,1,0,0,1,0,0,0,2,2,0,2,0
Positive charge (FAUJ880111),0,1,0,0,0,0,0,0,1,0,0,1,0,0,0,0,0,0,0,0
Negative charge (FAUJ880112),0,0,0,1,0,0,1,0,0,0,0,0,0,0,0,0,0,0,0,0
pK-a(RCOOH) (FAUJ880113),4.76,4.3,3.64,5.69,3.67,4.54,5.48,3.77,2.84,4.81,4.79,4.27,4.25,4.31,0,3.83,3.87,4.75,4.3,4.86
Helix-coil equilibrium constant (FINA770101),1.08,1.05,0.85,0.85,0.95,0.95,1.15,0.55,1,1.05,1.25,1.15,1.15,1.1,0.71,0.75,0.75,1.1,1.1,0.95
Helix initiation parameter at posision i-1 (FINA910101),1,0.7,1.7,3.2,1,1,1.7,1,1,0.6,1,0.7,1,1,1,1.7,1.7,1,1,0.6
"Helix initiation parameter at posision i,i+1,i+2 (FINA910102)",1,0.7,1,1.7,1,1,1.7,1.3,1,1,1,0.7,1,1,13,1,1,1,1,1
"Helix termination parameter at posision j-2,j-1,j (FINA910103)",1.2,1.7,1.2,0.7,1,1,0.7,0.8,1.2,0.8,1,1.7,1,1,1,1.5,1,1,1,0.8
Helix termination parameter at posision j+1 (FINA910104),1,1.7,1,0.7,1,1,0.7,1.5,1,1,1,1.7,1,1,0.1,1,1,1,1,1
Partition coefficient (GARJ730101),0.28,0.1,0.25,0.21,0.28,0.35,0.33,0.17,0.21,0.82,1,0.09,0.74,2.18,0.39,0.12,0.21,5.7,1.26,0.6
Alpha-helix indices (GEIM800101),1.29,1,0.81,1.1,0.79,1.07,1.49,0.63,1.33,1.05,1.31,1.33,1.54,1.13,0.63,0.78,0.77,1.18,0.71,0.81
Alpha-helix indices for alpha-proteins (GEIM800102),1.13,1.09,1.06,0.94,1.32,0.93,1.2,0.83,1.09,1.05,1.13,1.08,1.23,1.01,0.82,1.01,1.17,1.32,0.88,1.13
Alpha-helix indices for beta-proteins (GEIM800103),1.55,0.2,1.2,1.55,1.44,1.13,1.67,0.59,1.21,1.27,1.25,1.2,1.37,0.4,0.21,1.01,0.55,1.86,1.08,0.64
Alpha-helix indices for alpha/beta-proteins (GEIM800104),1.19,1,0.94,1.07,0.95,1.32,1.64,0.6,1.03,1.12,1.18,1.27,1.49,1.02,0.68,0.81,0.85,1.18,0.77,0.74
Beta-strand indices (GEIM800105),0.84,1.04,0.66,0.59,1.27,1.02,0.57,0.94,0.81,1.29,1.1,0.86,0.88,1.15,0.8,1.05,1.2,1.15,1.39,1.56
Beta-strand indices for beta-proteins (GEIM800106),0.86,1.15,0.6,0.66,0.91,1.11,0.37,0.86,1.07,1.17,1.28,1.01,1.15,1.34,0.61,0.91,1.14,1.13,1.37,1.31
Beta-strand indices for alpha/beta-proteins (GEIM800107),0.91,0.99,0.72,0.74,1.12,0.9,0.41,0.91,1.01,1.29,1.23,0.86,0.96,1.26,0.65,0.93,1.05,1.15,1.21,1.58
Aperiodic indices (GEIM800108),0.91,1,1.64,1.4,0.93,0.94,0.97,1.51,0.9,0.65,0.59,0.82,0.58,0.72,1.66,1.23,1.04,0.67,0.92,0.6
Aperiodic indices for alpha-proteins (GEIM800109),0.8,0.96,1.1,1.6,0,1.6,0.4,2,0.96,0.85,0.8,0.94,0.39,1.2,2.1,1.3,0.6,0,1.8,0.8
Aperiodic indices for beta-proteins (GEIM800110),1.1,0.93,1.57,1.41,1.05,0.81,1.4,1.3,0.85,0.67,0.52,0.94,0.69,0.6,1.77,1.13,0.88,0.62,0.41,0.58
Aperiodic indices for alpha/beta-proteins (GEIM800111),0.93,1.01,1.36,1.22,0.92,0.83,1.05,1.45,0.96,0.58,0.59,0.91,0.6,0.71,1.67,1.25,1.08,0.68,0.98,0.62
Hydrophobicity factor (GOLD730101),0.75,0.75,0.69,0,1,0.59,0,0,0,2.95,2.4,1.5,1.3,2.65,2.6,0,0.45,3,2.85,1.7
Residue volume (GOLD730102),88.3,181.2,125.1,110.8,112.4,148.7,140.5,60,152.6,168.5,168.5,175.6,162.2,189,122.2,88.7,118.2,227,193,141.4
Composition (GRAR740101),0,0.65,1.33,1.38,2.75,0.89,0.92,0.74,0.58,0,0,0.33,0,0,0.39,1.42,0.71,0.13,0.2,0
Polarity (GRAR740102),8.1,10.5,11.6,13,5.5,10.5,12.3,9,10.4,5.2,4.9,11.3,5.7,5.2,8,9.2,8.6,5.4,6.2,5.9
Volume (GRAR740103),31,124,56,54,55,85,83,3,96,111,111,119,105,132,32.5,32,61,170,136,84
Partition energy (GUYH850101),0.1,1.91,0.48,0.78,-1.42,0.95,0.83,0.33,-0.5,-1.13,-1.18,1.4,-1.59,-2.12,0.73,0.52,0.07,-0.51,-0.21,-1.27
"Hydration number (Hopfinger, 1971), Cited by Charton-Charton (HOPA770101)",1,2.3,2.2,6.5,0.1,2.1,6.2,1.1,2.8,0.8,0.8,5.3,0.7,1.4,0.9,1.7,1.5,1.9,2.1,0.9
Hydrophilicity value (HOPT810101),-0.5,3,0.2,3,-1,0.2,3,0,-0.5,-1.8,-1.8,3,-1.3,-2.5,0,0.3,-0.4,-3.4,-2.3,-1.5
Heat capacity (HUTJ700101),29.22,26.37,38.3,37.09,50.7,44.02,41.84,23.71,59.64,45,48.03,57.1,69.32,48.52,36.13,32.4,35.2,56.92,51.73,40.35
Absolute entropy (HUTJ700102),30.88,68.43,41.7,40.66,53.83,46.62,44.98,24.74,65.99,49.71,50.62,63.21,55.32,51.06,39.21,35.65,36.5,60,51.15,42.75
Entropy of formation (HUTJ700103),154.33,341.01,207.9,194.91,219.79,235.51,223.16,127.9,242.54,233.21,232.3,300.46,202.65,204.74,179.93,174.06,205.8,237.01,229.15,207.6
Normalized relative frequency of alpha-helix (ISOY800101),1.53,1.17,0.6,1,0.89,1.27,1.63,0.44,1.03,1.07,1.32,1.26,1.66,1.22,0.25,0.65,0.86,1.05,0.7,0.93
Normalized relative frequency of extended structure (ISOY800102),0.86,0.98,0.74,0.69,1.39,0.89,0.66,0.7,1.06,1.31,1.01,0.77,1.06,1.16,1.16,1.09,1.24,1.17,1.28,1.4
Normalized relative frequency of bend (ISOY800103),0.78,1.06,1.56,1.5,0.6,0.78,0.97,1.73,0.83,0.4,0.57,1.01,0.3,0.67,1.55,1.19,1.09,0.74,1.14,0.44
Normalized relative frequency of bend R (ISOY800104),1.09,0.97,1.14,0.77,0.5,0.83,0.92,1.25,0.67,0.66,0.44,1.25,0.45,0.5,2.96,1.21,1.33,0.62,0.94,0.56
Normalized relative frequency of bend S (ISOY800105),0.35,0.75,2.12,2.16,0.5,0.73,0.65,2.4,1.19,0.12,0.58,0.83,0.22,0.89,0.43,1.24,0.85,0.62,1.44,0.43
Normalized relative frequency of helix end (ISOY800106),1.09,1.07,0.88,1.24,1.04,1.09,1.14,0.27,1.07,0.97,1.3,1.2,0.55,0.8,1.78,1.2,0.99,1.03,0.69,0.77
Normalized relative frequency of double bend (ISOY800107),1.34,2.78,0.92,1.77,1.44,0.79,2.54,0.95,0,0.52,1.05,0.79,0,0.43,0.37,0.87,1.14,1.79,0.73,0
Normalized relative frequency of coil (ISOY800108),0.47,0.52,2.16,1.15,0.41,0.95,0.64,3.03,0.89,0.62,0.53,0.98,0.68,0.61,0.63,1.03,0.39,0.63,0.83,0.76
Average accessible surface area (JANJ780101),27.8,94.7,60.1,60.6,15.5,68.7,68.2,24.5,50.7,22.8,27.6,103,33.5,25.5,51.5,42,45,34.7,55.2,23.7
Percentage of buried residues (JANJ780102),51,5,22,19,74,16,16,52,34,66,60,3,52,58,25,35,30,49,24,64
Percentage of exposed residues (JANJ780103),15,67,49,50,5,56,55,10,34,13,16,85,20,10,45,32,32,17,41,14
Ratio of buried and accessible molar fractions (JANJ790101),1.7,0.1,0.4,0.4,4.6,0.3,0.3,1.8,0.8,3.1,2.4,0.05,1.9,2.2,0.6,0.8,0.7,1.6,0.5,2.9
Transfer free energy (JANJ790102),0.3,-1.4,-0.5,-0.6,0.9,-0.7,-0.7,0.3,-0.1,0.7,0.5,-1.8,0.4,0.5,-0.3,-0.1,-0.2,0.3,-0.4,0.6
Hydrophobicity (JOND750101),0.87,0.85,0.09,0.66,1.52,0,0.67,0.1,0.87,3.15,2.17,1.64,1.67,2.87,2.77,0.07,0.07,3.77,2.67,1.87
pK (-COOH) (JOND750102),2.34,1.18,2.02,2.01,1.65,2.17,2.19,2.34,1.82,2.36,2.36,2.18,2.28,1.83,1.99,2.21,2.1,2.38,2.2,2.32
Relative frequency of occurrence (JOND920101),0.077,0.051,0.043,0.052,0.02,0.041,0.062,0.074,0.023,0.053,0.091,0.059,0.024,0.04,0.051,0.069,0.059,0.014,0.032,0.066
Relative mutability (JOND920102),100,83,104,86,44,84,77,50,91,103,54,72,93,51,58,117,107,25,50,98
Amino acid distribution (JUKT750101),5.3,2.6,3,3.6,1.3,2.4,3.3,4.8,1.4,3.1,4.7,4.1,1.1,2.3,2.5,4.5,3.7,0.8,2.3,4.2
Sequence frequency (JUNJ780101),685,382,397,400,241,313,427,707,155,394,581,575,132,303,366,593,490,99,292,553
Average relative probability of helix (KANM800101),1.36,1,0.89,1.04,0.82,1.14,1.48,0.63,1.11,1.08,1.21,1.22,1.45,1.05,0.52,0.74,0.81,0.97,0.79,0.94
Average relative probability of beta-sheet (KANM800102),0.81,0.85,0.62,0.71,1.17,0.98,0.53,0.88,0.92,1.48,1.24,0.77,1.05,1.2,0.61,0.92,1.18,1.18,1.23,1.66
Average relative probability of inner helix (KANM800103),1.45,1.15,0.64,0.91,0.7,1.14,1.29,0.53,1.13,1.23,1.56,1.27,1.83,1.2,0.21,0.48,0.77,1.17,0.74,1.1
Average relative probability of inner beta-sheet (KANM800104),0.75,0.79,0.33,0.31,1.46,0.75,0.46,0.83,0.83,1.87,1.56,0.66,0.86,1.37,0.52,0.82,1.36,0.79,1.08,2
Flexibility parameter for no rigid neighbors (KARP850101),1.041,1.038,1.117,1.033,0.96,1.165,1.094,1.142,0.982,1.002,0.967,1.093,0.947,0.93,1.055,1.169,1.073,0.925,0.961,0.982
Flexibility parameter for one rigid neighbor (KARP850102),0.946,1.028,1.006,1.089,0.878,1.025,1.036,1.042,0.952,0.892,0.961,1.082,0.862,0.912,1.085,1.048,1.051,0.917,0.93,0.927
Flexibility parameter for two rigid neighbors (KARP850103),0.892,0.901,0.93,0.932,0.925,0.885,0.933,0.923,0.894,0.872,0.921,1.057,0.804,0.914,0.932,0.923,0.934,0.803,0.837,0.913
The Kerr-constant increments (KHAG800101),49.1,133,-3.6,0,0,20,0,64.6,75.7,18.9,15.6,0,6.8,54.7,43.8,44.4,31,70.5,0,29.5
Net charge (KLEP840101),0,1,0,-1,0,0,-1,0,0,0,0,1,0,0,0,0,0,0,0,0
Side chain interaction parameter (KRIW710101),4.6,6.5,5.9,5.7,-1,6.1,5.6,7.6,4.5,2.6,3.25,7.9,1.4,3.2,7,5.25,4.8,4,4.35,3.4
Side chain interaction parameter (KRIW790101),4.32,6.55,6.24,6.04,1.73,6.13,6.17,6.09,5.66,2.31,3.93,7.92,2.44,2.59,7.19,5.37,5.16,2.78,3.58,3.31
Fraction of site occupied by water (KRIW790102),0.28,0.34,0.31,0.33,0.11,0.39,0.37,0.28,0.23,0.12,0.16,0.59,0.08,0.1,0.46,0.27,0.26,0.15,0.25,0.22
Side chain volume (KRIW790103),27.5,105,58.7,40,44.6,80.7,62,0,79,93.5,93.5,100,94.1,115.5,41.9,29.3,51.3,145.5,117.3,71.5
Hydropathy index (KYTJ820101),1.8,-4.5,-3.5,-3.5,2.5,-3.5,-3.5,-0.4,-3.2,4.5,3.8,-3.9,1.9,2.8,-1.6,-0.8,-0.7,-0.9,-1.3,4.2
"Transfer free energy, CHP/water (LAWE840101)",-0.48,-0.06,-0.87,-0.75,-0.32,-0.32,-0.71,0,-0.51,0.81,1.02,-0.09,0.81,1.03,2.03,0.05,-0.35,0.66,1.24,0.56
Hydrophobic parameter (LEVM760101),-0.5,3,0.2,2.5,-1,0.2,2.5,0,-0.5,-1.8,-1.8,3,-1.3,-2.5,-1.4,0.3,-0.4,-3.4,-2.3,-1.5
Distance between C-alpha and centroid of side chain (LEVM760102),0.77,3.72,1.98,1.99,1.38,2.58,2.63,0,2.76,1.83,2.08,2.94,2.34,2.97,1.42,1.28,1.43,3.58,3.36,1.49
Side chain angle theta(AAR) (LEVM760103),121.9,121.4,117.5,121.2,113.7,118,118.2,0,118.2,118.9,118.1,122,113.1,118.2,81.9,117.9,117.1,118.4,110,121.7
Side chain torsion angle phi(AAAR) (LEVM760104),243.2,206.6,207.1,215,209.4,205.4,213.6,300,219.9,217.9,205.6,210.9,204,203.7,237.4,232,226.7,203.7,195.6,220.3
Radius of gyration of side chain (LEVM760105),0.77,2.38,1.45,1.43,1.22,1.75,1.77,0.58,1.78,1.56,1.54,2.08,1.8,1.9,1.25,1.08,1.24,2.21,2.13,1.29
van der Waals parameter R0 (LEVM760106),5.2,6,5,5,6.1,6,6,4.2,6,7,7,6,6.8,7.1,6.2,4.9,5,7.6,7.1,6.4
van der Waals parameter epsilon (LEVM760107),0.025,0.2,0.1,0.1,0.1,0.1,0.1,0.025,0.1,0.19,0.19,0.2,0.19,0.39,0.17,0.025,0.1,0.56,0.39,0.15
"Normalized frequency of alpha-helix, with weights (LEVM780101)",1.29,0.96,0.9,1.04,1.11,1.27,1.44,0.56,1.22,0.97,1.3,1.23,1.47,1.07,0.52,0.82,0.82,0.99,0.72,0.91
"Normalized frequency of beta-sheet, with weights (LEVM780102)",0.9,0.99,0.76,0.72,0.74,0.8,0.75,0.92,1.08,1.45,1.02,0.77,0.97,1.32,0.64,0.95,1.21,1.14,1.25,1.49
"Normalized frequency of reverse turn, with weights (LEVM780103)",0.77,0.88,1.28,1.41,0.81,0.98,0.99,1.64,0.68,0.51,0.58,0.96,0.41,0.59,1.91,1.32,1.04,0.76,1.05,0.47
"Normalized frequency of alpha-helix, unweighted (LEVM780104)",1.32,0.98,0.95,1.03,0.92,1.1,1.44,0.61,1.31,0.93,1.31,1.25,1.39,1.02,0.58,0.76,0.79,0.97,0.73,0.93
"Normalized frequency of beta-sheet, unweighted (LEVM780105)",0.86,0.97,0.73,0.69,1.04,1,0.66,0.89,0.85,1.47,1.04,0.77,0.93,1.21,0.68,1.02,1.27,1.26,1.31,1.43
"Normalized frequency of reverse turn, unweighted (LEVM780106)",0.79,0.9,1.25,1.47,0.79,0.92,1.02,1.67,0.81,0.5,0.57,0.99,0.51,0.77,1.78,1.3,0.97,0.79,0.93,0.46
Frequency of occurrence in beta-bends (LEWP710101),0.22,0.28,0.42,0.73,0.2,0.26,0.08,0.58,0.14,0.22,0.19,0.27,0.38,0.08,0.46,0.55,0.49,0.43,0.46,0.08
Conformational preference for all beta-strands (LIFS790101),0.92,0.93,0.6,0.48,1.16,0.95,0.61,0.61,0.93,1.81,1.3,0.7,1.19,1.25,0.4,0.82,1.12,1.54,1.53,1.81
Conformational preference for parallel beta-strands (LIFS790102),1,0.68,0.54,0.5,0.91,0.28,0.59,0.79,0.38,2.6,1.42,0.59,1.49,1.3,0.35,0.7,0.59,0.89,1.08,2.63
Conformational preference for antiparallel beta-strands (LIFS790103),0.9,1.02,0.62,0.47,1.24,1.18,0.62,0.56,1.12,1.54,1.26,0.74,1.09,1.23,0.42,0.87,1.3,1.75,1.68,1.53
Average surrounding hydrophobicity (MANP780101),12.97,11.72,11.42,10.85,14.63,11.76,11.89,12.43,12.16,15.67,14.9,11.36,14.39,14,11.37,11.23,11.69,13.93,13.42,15.71
Normalized frequency of alpha-helix (MAXF760101),1.43,1.18,0.64,0.92,0.94,1.22,1.67,0.46,0.98,1.04,1.36,1.27,1.53,1.19,0.49,0.7,0.78,1.01,0.69,0.98
Normalized frequency of extended structure (MAXF760102),0.86,0.94,0.74,0.72,1.17,0.89,0.62,0.97,1.06,1.24,0.98,0.79,1.08,1.16,1.22,1.04,1.18,1.07,1.25,1.33
Normalized frequency of zeta R (MAXF760103),0.64,0.62,3.14,1.92,0.32,0.8,1.01,0.63,2.05,0.92,0.37,0.89,1.07,0.86,0.5,1.01,0.92,1,1.31,0.87
Normalized frequency of left-handed alpha-helix (MAXF760104),0.17,0.76,2.62,1.08,0.95,0.91,0.28,5.02,0.57,0.26,0.21,1.17,0,0.28,0.12,0.57,0.23,0,0.97,0.24
Normalized frequency of zeta L (MAXF760105),1.13,0.48,1.11,1.18,0.38,0.41,1.02,3.84,0.3,0.4,0.65,1.13,0,0.45,0,0.81,0.71,0.93,0.38,0.48
Normalized frequency of alpha region (MAXF760106),1,1.18,0.87,1.39,1.09,1.13,1.04,0.46,0.71,0.68,1.01,1.05,0.36,0.65,1.95,1.56,1.23,1.1,0.87,0.58
"Refractivity (McMeekin et al., 1964), Cited by Jones (MCMT640101)",4.34,26.66,13.28,12,35.77,17.56,17.26,0,21.81,19.06,18.78,21.29,21.64,29.4,10.93,6.35,11.01,42.53,31.53,13.92
"Retention coefficient in HPLC, pH7.4 (MEEJ800101)",0.5,0.8,0.8,-8.2,-6.8,-4.8,-16.9,0,-3.5,13.9,8.8,0.1,4.8,13.2,6.1,1.2,2.7,14.9,6.1,2.7
"Retention coefficient in HPLC, pH2.1 (MEEJ800102)",-0.1,-4.5,-1.6,-2.8,-2.2,-2.5,-7.5,-0.5,0.8,11.8,10,-3.2,7.1,13.9,8,-3.7,1.5,18.1,8.2,3.3
Retention coefficient in NaClO4 (MEEJ810101),1.1,-0.4,-4.2,-1.6,7.1,-2.9,0.7,-0.2,-0.7,8.5,11,-1.9,5.4,13.4,4.4,-3.2,-1.7,17.1,7.4,5.9
Retention coefficient in NaH2PO4 (MEEJ810102),1,-2,-3,-0.5,4.6,-2,1.1,0.2,-2.2,7,9.6,-3,4,12.6,3.1,-2.9,-0.6,15.1,6.7,4.6
Average reduced distance for C-alpha (MEIH800101),0.93,0.98,0.98,1.01,0.88,1.02,1.02,1.01,0.89,0.79,0.85,1.05,0.84,0.78,1,1.02,0.99,0.83,0.93,0.81
Average reduced distance for side chain (MEIH800102),0.94,1.09,1.04,1.08,0.84,1.11,1.12,1.01,0.92,0.76,0.82,1.23,0.83,0.73,1.04,1.04,1.02,0.87,1.03,0.81
