Chemical Property,A,R,N,D,C,Q,E,G,H,I,L,K,M,F,P,S,T,W,Y,V
Average side chain orientation angle (MEIH800103),87,81,70,71,104,66,72,90,90,105,104,65,100,108,78,83,83,94,83,94
Effective partition energy (MIYS850101),2.36,1.92,1.7,1.67,3.36,1.75,1.74,2.06,2.41,4.17,3.93,1.23,4.22,4.37,1.89,1.81,2.04,3.82,2.91,3.49
Normalized frequency of alpha-helix (NAGK730101),1.29,0.83,0.77,1,0.94,1.1,1.54,0.72,1.29,0.94,1.23,1.23,1.23,1.23,0.7,0.78,0.87,1.06,0.63,0.97
Normalized frequency of bata-structure (NAGK730102),0.96,0.67,0.72,0.9,1.13,1.18,0.33,0.9,0.87,1.54,1.26,0.81,1.29,1.37,0.75,0.77,1.23,1.13,1.07,1.41
Normalized frequency of coil (NAGK730103),0.72,1.33,1.38,1.04,1.01,0.81,0.75,1.35,0.76,0.8,0.63,0.84,0.62,0.58,1.43,1.34,1.03,0.87,1.35,0.83
AA composition of total proteins (NAKH900101),7.99,5.86,4.33,5.14,1.81,3.98,6.1,6.91,2.17,5.48,9.16,6.01,2.5,3.83,4.95,6.84,5.77,1.34,3.15,6.65
SD of AA composition of total proteins (NAKH900102),3.73,3.34,2.33,2.23,2.3,2.36,3,3.36,1.55,2.52,3.4,3.36,1.37,1.94,3.18,2.83,2.63,1.15,1.76,2.53
AA composition of mt-proteins (NAKH900103),5.74,1.92,5.25,2.11,1.03,2.3,2.63,5.66,2.3,9.12,15.36,3.2,5.3,6.51,4.79,7.55,7.51,2.51,4.08,5.12
Normalized composition of mt-proteins (NAKH900104),-0.6,-1.18,0.39,-1.36,-0.34,-0.71,-1.16,-0.37,0.08,1.44,1.82,-0.84,2.04,1.38,-0.05,0.25,0.66,1.02,0.53,-0.6
AA composition of mt-proteins from animal (NAKH900105),5.88,1.54,4.38,1.7,1.11,2.3,2.6,5.29,2.33,8.78,16.52,2.58,6,6.58,5.29,7.68,8.38,2.89,3.51,4.66
Normalized composition from animal (NAKH900106),-0.57,-1.29,0.02,-1.54,-0.3,-0.71,-1.17,-0.48,0.1,1.31,2.16,-1.02,2.55,1.42,0.11,0.3,0.99,1.35,0.2,-0.79
AA composition of mt-proteins from fungi and plant (NAKH900107),5.39,2.81,7.31,3.07,0.86,2.31,2.7,6.52,2.23,9.94,12.64,4.67,3.68,6.34,3.62,7.24,5.44,1.64,5.42,6.18
Normalized composition from fungi and plant (NAKH900108),-0.7,-0.91,1.28,-0.93,-0.41,-0.71,-1.13,-0.12,0.04,1.77,1.02,-0.4,0.86,1.29,-0.42,0.14,-0.13,0.26,1.29,-0.19
AA composition of membrane proteins (NAKH900109),9.25,3.96,3.71,3.89,1.07,3.17,4.8,8.51,1.88,6.47,10.94,3.5,3.14,6.36,4.36,6.26,5.66,2.22,3.28,7.55
Normalized composition of membrane proteins (NAKH900110),0.34,-0.57,-0.27,-0.56,-0.32,-0.34,-0.43,0.48,-0.19,0.39,0.52,-0.75,0.47,1.3,-0.19,-0.2,-0.04,0.77,0.07,0.36
Transmembrane regions of non-mt-proteins (NAKH900111),10.17,1.21,1.36,1.18,1.48,1.57,1.15,8.87,1.07,10.91,16.22,1.04,4.12,9.6,2.24,5.38,5.61,2.67,2.68,11.44
Transmembrane regions of mt-proteins (NAKH900112),6.61,0.41,1.84,0.59,0.83,1.2,1.63,4.88,1.14,12.91,21.66,1.15,7.17,7.76,3.51,6.84,8.89,2.11,2.57,6.3
Ratio of average and computed composition (NAKH900113),1.61,0.4,0.73,0.75,0.37,0.61,1.5,3.12,0.46,1.61,1.37,0.62,1.59,1.24,0.67,0.68,0.92,1.63,0.67,1.3
AA composition of CYT of single-spanning proteins (NAKH920101),8.63,6.75,4.18,6.24,1.03,4.76,7.82,6.8,2.7,3.48,8.44,6.25,2.14,2.73,6.28,8.53,4.43,0.8,2.54,5.44
AA composition of CYT2 of single-spanning proteins (NAKH920102),10.88,6.01,5.75,6.13,0.69,4.68,9.34,7.72,2.15,1.8,8.03,6.11,3.79,2.93,7.21,7.25,3.51,0.47,1.01,4.57
AA composition of EXT of single-spanning proteins (NAKH920103),5.15,4.38,4.81,5.75,3.24,4.45,7.05,6.38,2.69,4.4,8.11,5.25,1.6,3.52,5.65,8.04,7.41,1.68,3.42,7
AA composition of EXT2 of single-spanning proteins (NAKH920104),5.04,3.73,5.94,5.26,2.2,4.5,6.07,7.09,2.99,4.32,9.88,6.31,1.85,3.72,6.22,8.05,5.2,2.1,3.32,6.19
AA composition of MEM of single-spanning proteins (NAKH920105),9.9,0.09,0.94,0.35,2.55,0.87,0.08,8.14,0.2,15.25,22.28,0.16,1.85,6.47,2.38,4.17,4.33,2.21,3.42,14.34
AA composition of CYT of multi-spanning proteins (NAKH920106),6.69,6.65,4.49,4.97,1.7,5.39,7.76,6.32,2.11,4.51,8.23,8.36,2.46,3.59,5.2,7.4,5.18,1.06,2.75,5.27
AA composition of EXT of multi-spanning proteins (NAKH920107),5.08,4.75,5.75,5.96,2.95,4.24,6.04,8.2,2.1,4.95,8.03,4.93,2.61,4.36,4.84,6.41,5.87,2.31,4.55,6.07
AA composition of MEM of multi-spanning proteins (NAKH920108),9.36,0.27,2.31,0.94,2.56,1.14,0.94,6.17,0.47,13.73,16.64,0.58,3.93,10.99,1.96,5.58,4.68,2.2,3.13,12.43
8 A contact number (NISK800101),0.23,-0.26,-0.94,-1.13,1.78,-0.57,-0.75,-0.07,0.11,1.19,1.03,-1.05,0.66,0.48,-0.76,-0.67,-0.36,0.9,0.59,1.24
14 A contact number (NISK860101),-0.22,-0.93,-2.65,-4.12,4.66,-2.76,-3.64,-1.62,1.28,5.58,5.01,-4.18,3.51,5.27,-3.03,-2.84,-1.2,5.2,2.15,4.45
"Transfer energy, organic solvent/water (NOZY710101)",0.5,0,0,0,0,0,0,0,0.5,1.8,1.8,0,1.3,2.5,0,0,0.4,3.4,2.3,1.5
Average non-bonded energy per atom (OOBM770101),-1.895,-1.475,-1.56,-1.518,-2.035,-1.521,-1.535,-1.898,-1.755,-1.951,-1.966,-1.374,-1.963,-1.864,-1.699,-1.753,-1.767,-1.869,-1.686,-1.981
Short and medium range non-bonded energy per atom (OOBM770102),-1.404,-0.921,-1.178,-1.162,-1.365,-1.116,-1.163,-1.364,-1.215,-1.189,-1.315,-1.074,-1.303,-1.135,-1.236,-1.297,-1.252,-1.03,-1.03,-1.254
Long range non-bonded energy per atom (OOBM770103),-0.491,-0.554,-0.382,-0.356,-0.67,-0.405,-0.371,-0.534,-0.54,-0.762,-0.65,-0.3,-0.659,-0.729,-0.463,-0.455,-0.515,-0.839,-0.656,-0.728
Average non-bonded energy per residue (OOBM770104),-9.475,-16.225,-12.48,-12.144,-12.21,-13.689,-13.815,-7.592,-17.55,-15.608,-15.728,-12.366,-15.704,-20.504,-11.893,-10.518,-12.369,-26.166,-20.232,-13.867
Short and medium range non-bonded energy per residue (OOBM770105),-7.02,-10.131,-9.424,-9.296,-8.19,-10.044,-10.467,-5.456,-12.15,-9.512,-10.52,-9.666,-10.424,-12.485,-8.652,-7.782,-8.764,-14.42,-12.36,-8.778
Optimized beta-structure-coil equilibrium constant (OOBM850101),2.01,0.84,0.03,-2.05,1.98,1.02,0.93,0.12,-0.14,3.7,2.73,2.55,1.75,2.68,0.41,1.47,2.39,2.49,2.23,3.5
Optimized propensity to form reverse turn (OOBM850102),1.34,0.95,2.49,3.32,1.07,1.49,2.2,2.07,1.27,0.66,0.54,0.61,0.7,0.8,2.12,0.94,1.09,-4.65,-0.17,1.32
Optimized transfer energy parameter (OOBM850103),0.46,-1.54,1.31,-0.33,0.2,-1.12,0.48,0.64,-1.31,3.28,0.43,-1.71,0.15,0.52,-0.58,-0.83,-1.52,1.25,-2.21,0.54
Optimized average non-bonded energy per atom (OOBM850104),-2.49,2.55,2.27,8.86,-3.13,1.79,4.04,-0.56,4.22,-10.87,-7.16,-9.97,-4.96,-6.64,5.19,-1.6,-4.75,-17.84,9.25,-3.97
Optimized side chain interaction parameter (OOBM850105),4.55,5.97,5.56,2.85,-0.78,4.15,5.16,9.14,4.48,2.1,3.24,10.68,2.18,4.37,5.14,6.78,8.6,1.97,2.4,3.81
Normalized frequency of alpha-helix from LG (PALJ810101),1.3,0.93,0.9,1.02,0.92,1.04,1.43,0.63,1.33,0.87,1.3,1.23,1.32,1.09,0.63,0.78,0.8,1.03,0.71,0.95
Normalized frequency of alpha-helix from CF (PALJ810102),1.32,1.04,0.74,0.97,0.7,1.25,1.48,0.59,1.06,1.01,1.22,1.13,1.47,1.1,0.57,0.77,0.86,1.02,0.72,1.05
Normalized frequency of beta-sheet from LG (PALJ810103),0.81,1.03,0.81,0.71,1.12,1.03,0.59,0.94,0.85,1.47,1.03,0.77,0.96,1.13,0.75,1.02,1.19,1.24,1.35,1.44
Normalized frequency of beta-sheet from CF (PALJ810104),0.9,0.75,0.82,0.75,1.12,0.95,0.44,0.83,0.86,1.59,1.24,0.75,0.94,1.41,0.46,0.7,1.2,1.28,1.45,1.73
Normalized frequency of turn from LG (PALJ810105),0.84,0.91,1.48,1.28,0.69,1,0.78,1.76,0.53,0.55,0.49,0.95,0.52,0.88,1.47,1.29,1.05,0.88,1.28,0.51
Normalized frequency of turn from CF (PALJ810106),0.65,0.93,1.45,1.47,1.43,0.94,0.75,1.53,0.96,0.57,0.56,0.95,0.71,0.72,1.51,1.46,0.96,0.9,1.12,0.55
Normalized frequency of alpha-helix in all-alpha class (PALJ810107),1.08,0.93,1.05,0.86,1.22,0.95,1.09,0.85,1.02,0.98,1.04,1.01,1.11,0.96,0.91,0.95,1.15,1.17,0.8,1.03
Normalized frequency of alpha-helix in alpha+beta class (PALJ810108),1.34,0.91,0.83,1.06,1.27,1.13,1.69,0.47,1.11,0.84,1.39,1.08,0.9,1.02,0.48,1.05,0.74,0.64,0.73,1.18
Normalized frequency of alpha-helix in alpha/beta class (PALJ810109),1.15,1.06,0.87,1,1.03,1.43,1.37,0.64,0.95,0.99,1.22,1.2,1.45,0.92,0.72,0.84,0.97,1.11,0.72,0.82
Normalized frequency of beta-sheet in all-beta class (PALJ810110),0.89,1.06,0.67,0.71,1.04,1.06,0.72,0.87,1.04,1.14,1.02,1,1.41,1.32,0.69,0.86,1.15,1.06,1.35,1.66
Normalized frequency of beta-sheet in alpha+beta class (PALJ810111),0.82,0.99,1.27,0.98,0.71,1.01,0.54,0.94,1.26,1.67,0.94,0.73,1.3,1.56,0.69,0.65,0.98,1.25,1.26,1.22
Normalized frequency of beta-sheet in alpha/beta class (PALJ810112),0.98,1.03,0.66,0.74,1.01,0.63,0.59,0.9,1.17,1.38,1.05,0.83,0.82,1.23,0.73,0.98,1.2,1.26,1.23,1.62
Normalized frequency of turn in all-alpha class (PALJ810113),0.69,0,1.52,2.42,0,1.44,0.63,2.64,0.22,0.43,0,1.18,0.88,2.2,1.34,1.43,0.28,0,1.53,0.14
Normalized frequency of turn in all-beta class (PALJ810114),0.87,1.3,1.36,1.24,0.83,1.06,0.91,1.69,0.91,0.27,0.67,0.66,0,0.47,1.54,1.08,1.12,1.24,0.54,0.69
Normalized frequency of turn in alpha+beta class (PALJ810115),0.91,0.77,1.32,0.9,0.5,1.06,0.53,1.61,1.08,0.36,0.77,1.27,0.76,0.37,1.62,1.34,0.87,1.1,1.24,0.52
Normalized frequency of turn in alpha/beta class (PALJ810116),0.92,0.9,1.57,1.22,0.62,0.66,0.92,1.61,0.39,0.79,0.5,0.86,0.5,0.96,1.3,1.4,1.11,0.57,1.78,0.5
HPLC parameter (PARJ860101),2.1,4.2,7,10,1.4,6,7.8,5.7,2.1,-8,-9.2,5.7,-4.2,-9.2,2.1,6.5,5.2,-10,-1.9,-3.7
Partition coefficient (PLIV810101),-2.89,-3.3,-3.41,-3.38,-2.49,-3.15,-2.94,-3.25,-2.84,-1.72,-1.61,-3.31,-1.84,-1.63,-2.5,-3.3,-2.91,-1.75,-2.42,-2.08
Surrounding hydrophobicity in folded form (PONP800101),12.28,11.49,11,10.97,14.93,11.28,11.19,12.01,12.84,14.77,14.1,10.8,14.33,13.43,11.19,11.26,11.65,12.95,13.29,15.07
Average gain in surrounding hydrophobicity (PONP800102),7.62,6.81,6.17,6.18,10.93,6.67,6.38,7.31,7.85,9.99,9.37,5.72,9.83,8.99,6.64,6.93,7.08,8.41,8.53,10.38
Average gain ratio in surrounding hydrophobicity (PONP800103),2.63,2.45,2.27,2.29,3.36,2.45,2.31,2.55,2.57,3.08,2.98,2.12,3.18,3.02,2.46,2.6,2.55,2.85,2.79,3.21
Surrounding hydrophobicity in alpha-helix (PONP800104),13.65,11.28,12.24,10.98,14.49,11.3,12.55,15.36,11.59,14.63,14.01,11.96,13.4,14.08,11.51,11.26,13,12.06,12.64,12.88
Surrounding hydrophobicity in beta-sheet (PONP800105),14.6,13.24,11.79,13.78,15.9,12.02,13.59,14.18,15.35,14.1,16.49,13.28,16.23,14.18,14.1,13.36,14.5,13.9,14.76,16.3
Surrounding hydrophobicity in turn (PONP800106),10.67,11.05,10.85,10.21,14.15,11.71,11.71,10.95,12.07,12.95,13.07,9.93,15,13.27,10.62,11.18,10.53,11.41,11.52,13.86
Accessibility reduction ratio (PONP800107),3.7,2.53,2.12,2.6,3.03,2.7,3.3,3.13,3.57,7.69,5.88,1.79,5.21,6.6,2.12,2.43,2.6,6.25,3.03,7.14
Average number of surrounding residues (PONP800108),6.05,5.7,5.04,4.95,7.86,5.45,5.1,6.16,5.8,7.51,7.37,4.88,6.39,6.62,5.65,5.53,5.81,6.98,6.73,7.62
Intercept in regression analysis (PRAM820101),0.305,0.227,0.322,0.335,0.339,0.306,0.282,0.352,0.215,0.278,0.262,0.391,0.28,0.195,0.346,0.326,0.251,0.291,0.293,0.291
Slope in regression analysis x 1.0E1 (PRAM820102),0.175,0.083,0.09,0.14,0.074,0.093,0.135,0.201,0.125,0.1,0.104,0.058,0.054,0.104,0.136,0.155,0.152,0.092,0.081,0.096
Correlation coefficient in regression analysis (PRAM820103),0.687,0.59,0.489,0.632,0.263,0.527,0.669,0.67,0.594,0.564,0.541,0.407,0.328,0.577,0.6,0.692,0.713,0.632,0.495,0.529
Hydrophobicity (PRAM900101),-6.7,51.5,20.1,38.5,-8.4,17.2,34.3,-4.2,12.6,-13,-11.7,36.8,-14.2,-15.5,0.8,-2.5,-5,-7.9,2.9,-10.9
Relative frequency in reverse-turn (PRAM900104),0.78,0.88,1.28,1.41,0.8,0.97,1,1.64,0.69,0.51,0.59,0.96,0.39,0.58,1.91,1.33,1.03,0.75,1.05,0.47
Helix-coil equilibrium constant (PTIO830101),1.1,0.95,0.8,0.65,0.95,1,1,0.6,0.85,1.1,1.25,1,1.15,1.1,0.1,0.75,0.75,1.1,1.1,0.95
Beta-coil equilibrium constant (PTIO830102),1,0.7,0.6,0.5,1.9,1,0.7,0.3,0.8,4,2,0.7,1.9,3.1,0.2,0.9,1.7,2.2,2.8,4
Average reduced distance for C-alpha (RACS770101),0.934,0.962,0.986,0.994,0.9,1.047,0.986,1.015,0.882,0.766,0.825,1.04,0.804,0.773,1.047,1.056,1.008,0.848,0.931,0.825
Average reduced distance for side chain (RACS770102),0.941,1.112,1.038,1.071,0.866,1.15,1.1,1.055,0.911,0.742,0.798,1.232,0.781,0.723,1.093,1.082,1.043,0.867,1.05,0.817
Side chain orientational preference (RACS770103),1.16,1.72,1.97,2.66,0.5,3.87,2.4,1.63,0.86,0.57,0.51,3.9,0.4,0.43,2.04,1.61,1.48,0.75,1.72,0.59
Average relative fractional occurrence in A0(i) (RACS820101),0.85,2.02,0.88,1.5,0.9,1.71,1.79,1.54,1.59,0.67,1.03,0.88,1.17,0.85,1.47,1.5,1.96,0.83,1.34,0.89
Average relative fractional occurrence in AR(i) (RACS820102),1.58,1.14,0.77,0.98,1.04,1.24,1.49,0.66,0.99,1.09,1.21,1.27,1.41,1,1.46,1.05,0.87,1.23,0.68,0.88
Average relative fractional occurrence in AL(i) (RACS820103),0.82,2.6,2.07,2.64,0,0,2.62,1.63,0,2.32,0,2.86,0,0,0,1.23,2.48,0,1.9,1.62
Average relative fractional occurrence in EL(i) (RACS820104),0.78,1.75,1.32,1.25,3.14,0.93,0.94,1.13,1.03,1.26,0.91,0.85,0.41,1.07,1.73,1.31,1.57,0.98,1.31,1.11
Average relative fractional occurrence in E0(i) (RACS820105),0.88,0.99,1.02,1.16,1.14,0.93,1.01,0.7,1.87,1.61,1.09,0.83,1.71,1.52,0.87,1.14,0.96,1.96,1.68,1.56
Average relative fractional occurrence in ER(i) (RACS820106),0.3,0.9,2.73,1.26,0.72,0.97,1.33,3.09,1.33,0.45,0.96,0.71,1.89,1.2,0.83,1.16,0.97,1.58,0.86,0.64
Average relative fractional occurrence in A0(i-1) (RACS820107),0.4,1.2,1.24,1.59,2.98,0.5,1.26,1.89,2.71,1.31,0.57,0.87,0,1.27,0.38,0.92,1.38,1.53,1.79,0.95
Average relative fractional occurrence in AR(i-1) (RACS820108),1.48,1.02,0.99,1.19,0.86,1.42,1.43,0.46,1.27,1.12,1.33,1.36,1.41,1.3,0.25,0.89,0.81,1.27,0.91,0.93
Average relative fractional occurrence in AL(i-1) (RACS820109),0,0,4.14,2.15,0,0,0,6.49,0,0,0,0,0,2.11,1.99,0,1.24,0,1.9,0
Average relative fractional occurrence in EL(i-1) (RACS820110),1.02,1,1.31,1.76,1.05,1.05,0.83,2.39,0.4,0.83,1.06,0.94,1.33,0.41,2.73,1.18,0.77,1.22,1.09,0.88
Average relative fractional occurrence in E0(i-1) (RACS820111),0.93,1.52,0.92,0.6,1.08,0.94,0.73,0.78,1.08,1.74,1.03,1,1.31,1.51,1.37,0.97,1.38,1.12,1.65,1.7
Average relative fractional occurrence in ER(i-1) (RACS820112),0.99,1.19,1.15,1.18,2.32,1.52,1.36,1.4,1.06,0.81,1.26,0.91,1,1.25,0,1.5,1.18,1.33,1.09,1.01
Value of theta(i) (RACS820113),17.05,21.25,34.81,19.27,28.84,15.42,20.12,38.14,23.07,16.66,10.89,16.46,20.61,16.26,23.94,19.95,18.92,23.36,26.49,17.06
Value of theta(i-1) (RACS820114),14.53,17.82,13.59,19.78,30.57,22.18,18.19,37.16,22.63,20.28,14.3,14.07,20.61,19.61,52.63,18.56,21.09,19.78,26.36,21.87
Transfer free energy from chx to wat (RADA880101),1.81,-14.92,-6.64,-8.72,1.28,-5.54,-6.81,0.94,-4.66,4.92,4.92,-5.55,2.35,2.98,0,-3.4,-2.57,2.33,-0.14,4.04
Transfer free energy from oct to wat (RADA880102),0.52,-1.32,-0.01,0,0,-0.07,-0.79,0,0.95,2.04,1.76,0.08,1.32,2.09,0,0.04,0.27,2.51,1.63,1.18
Transfer free energy from vap to chx (RADA880103),0.13,-5,-3.04,-2.23,-2.52,-3.84,-3.43,1.45,-5.61,-2.77,-2.64,-3.97,-3.83,-3.74,0,-1.66,-2.31,-8.21,-5.97,-2.05
Transfer free energy from chx to oct (RADA880104),1.29,-13.6,-6.63,0,0,-5.47,-6.02,0.94,-5.61,2.88,3.16,-5.63,1.03,0.89,0,-3.44,-2.84,-0.18,-1.77,2.86
Transfer free energy from vap to oct (RADA880105),1.42,-18.6,-9.67,0,0,-9.31,-9.45,2.39,-11.22,0.11,0.52,-9.6,-2.8,-2.85,0,-5.1,-5.15,-8.39,-7.74,0.81
Accessible surface area (RADA880106),93.7,250.4,146.3,142.6,135.2,177.7,182.9,52.6,188.1,182.2,173.7,215.2,197.6,228.6,0,109.5,142.1,271.6,239.9,157.2
Energy transfer from out to in (95%buried) (RADA880107),-0.29,-2.71,-1.18,-1.02,0,-1.53,-0.9,-0.34,-0.94,0.24,-0.12,-2.05,-0.24,0,0,-0.75,-0.71,-0.59,-1.02,0.09
Mean polarity (RADA880108),-0.06,-0.84,-0.48,-0.8,1.36,-0.73,-0.77,-0.41,0.49,1.31,1.21,-1.18,1.27,1.27,0,-0.5,-0.27,0.88,0.33,1.09
"Relative preference value at N"" (RICJ880101)",0.7,0.4,1.2,1.4,0.6,1,1,1.6,1.2,0.9,0.9,1,0.3,1.2,0.7,1.6,0.3,1.1,1.9,0.7
Relative preference value at N-cap (RICJ880103),0.5,0.4,3.5,2.1,0.6,0.4,0.4,1.8,1.1,0.2,0.2,0.7,0.8,0.2,0.8,2.3,1.6,0.3,0.8,0.1
Relative preference value at N1 (RICJ880104),1.2,0.7,0.7,0.8,0.8,0.7,2.2,0.3,0.7,0.9,0.9,0.6,0.3,0.5,2.6,0.7,0.8,2.1,1.8,1.1
Relative preference value at N2 (RICJ880105),1.6,0.9,0.7,2.6,1.2,0.8,2,0.9,0.7,0.7,0.3,1,1,0.9,0.5,0.8,0.7,1.7,0.4,0.6
Relative preference value at N3 (RICJ880106),1,0.4,0.7,2.2,0.6,1.5,3.3,0.6,0.7,0.4,0.6,0.8,1,0.6,0.4,0.4,1,1.4,1.2,1.1
Relative preference value at N4 (RICJ880107),1.1,1.5,0,0.3,1.1,1.3,0.5,0.4,1.5,1.1,2.6,0.8,1.7,1.9,0.1,0.4,0.5,3.1,0.6,1.5
Relative preference value at N5 (RICJ880108),1.4,1.2,1.2,0.6,1.6,1.4,0.9,0.6,0.9,0.9,1.1,1.9,1.7,1,0.3,1.1,0.6,1.4,0.2,0.8
Relative preference value at Mid (RICJ880109),1.8,1.3,0.9,1,0.7,1.3,0.8,0.5,1,1.2,1.2,1.1,1.5,1.3,0.3,0.6,1,1.5,0.8,1.2
Relative preference value at C5 (RICJ880110),1.8,1,0.6,0.7,0,1,1.1,0.5,2.4,1.3,1.2,1.4,2.7,1.9,0.3,0.5,0.5,1.1,1.3,0.4
Relative preference value at C4 (RICJ880111),1.3,0.8,0.6,0.5,0.7,0.2,0.7,0.5,1.9,1.6,1.4,1,2.8,2.9,0,0.5,0.6,2.1,0.8,1.4
Relative preference value at C3 (RICJ880112),0.7,0.8,0.8,0.6,0.2,1.3,1.6,0.1,1.1,1.4,1.9,2.2,1,1.8,0,0.6,0.7,0.4,1.1,1.3
Relative preference value at C2 (RICJ880113),1.4,2.1,0.9,0.7,1.2,1.6,1.7,0.2,1.8,0.4,0.8,1.9,1.3,0.3,0.2,1.6,0.9,0.4,0.3,0.7
Relative preference value at C1 (RICJ880114),1.1,1,1.2,0.4,1.6,2.1,0.8,0.2,3.4,0.7,0.7,2,1,0.7,0,1.7,1,0,1.2,0.7
Relative preference value at C-cap (RICJ880115),0.8,0.9,1.6,0.7,0.4,0.9,0.3,3.9,1.3,0.7,0.7,1.3,0.8,0.5,0.7,0.8,0.3,0,0.8,0.2
Relative preference value at C' (RICJ880116),1,1.4,0.9,1.4,0.8,1.4,0.8,1.2,1.2,1.1,0.9,1.2,0.8,0.1,1.9,0.7,0.8,0.4,0.9,0.6
"Relative preference value at C"" (RICJ880117)",0.7,1.1,1.5,1.4,0.4,1.1,0.7,0.6,1,0.7,0.5,1.3,0,1.2,1.5,0.9,2.1,2.7,0.5,1
Information measure for alpha-helix (ROBB760101),6.5,-0.9,-5.1,0.5,-1.3,1,7.8,-8.6,1.2,0.6,3.2,2.3,5.3,1.6,-7.7,-3.9,-2.6,1.2,-4.5,1.4
Information measure for N-terminal helix (ROBB760102),2.3,-5.2,0.3,7.4,0.8,-0.7,10.3,-5.2,-2.8,-4,-2.1,-4.1,-3.5,-1.1,8.1,-3.5,2.3,-0.9,-3.7,-4.4
Information measure for middle helix (ROBB760103),6.7,0.3,-6.1,-3.1,-4.9,0.6,2.2,-6.8,-1,3.2,5.5,0.5,7.2,2.8,-22.8,-3,-4,4,-4.6,2.5
Information measure for C-terminal helix (ROBB760104),2.3,1.4,-3.3,-4.4,6.1,2.7,2.5,-8.3,5.9,-0.5,0.1,7.3,3.5,1.6,-24.4,-1.9,-3.7,-0.9,-0.6,2.3
Information measure for extended (ROBB760105),-2.3,0.4,-4.1,-4.4,4.4,1.2,-5,-4.2,-2.5,6.7,2.3,-3.3,2.3,2.6,-1.8,-1.7,1.3,-1,4,6.8
Information measure for pleated-sheet (ROBB760106),-2.7,0.4,-4.2,-4.4,3.7,0.8,-8.1,-3.9,-3,7.7,3.7,-2.9,3.7,3,-6.6,-2.4,1.7,0.3,3.3,7.1
Information measure for extended without H-bond (ROBB760107),0,1.1,-2,-2.6,5.4,2.4,3.1,-3.4,0.8,-0.1,-3.7,-3.1,-2.1,0.7,7.4,1.3,0,-3.4,4.8,2.7
Information measure for turn (ROBB760108),-5,2.1,4.2,3.1,4.4,0.4,-4.7,5.7,-0.3,-4.6,-5.6,1,-4.8,-1.8,2.6,2.6,0.3,3.4,2.9,-6
Information measure for N-terminal turn (ROBB760109),-3.3,0,5.4,3.9,-0.3,-0.4,-1.8,-1.2,3,-0.5,-2.3,-1.2,-4.3,0.8,6.5,1.8,-0.7,-0.8,3.1,-3.5
Information measure for middle turn (ROBB760110),-4.7,2,3.9,1.9,6.2,-2,-4.2,5.7,-2.6,-7,-6.2,2.8,-4.8,-3.7,3.6,2.1,0.6,3.3,3.8,-6.2
Information measure for C-terminal turn (ROBB760111),-3.7,1,-0.6,-0.6,4,3.4,-4.3,5.9,-0.8,-0.5,-2.8,1.3,-1.6,1.6,-6,1.5,1.2,6.5,1.3,-4.6
Information measure for coil (ROBB760112),-2.5,-1.2,4.6,0,-4.7,-0.5,-4.4,4.9,1.6,-3.3,-2,-0.8,-4.1,-4.1,5.8,2.5,1.7,1.2,-0.6,-3.5
Information measure for loop (ROBB760113),-5.1,2.6,4.7,3.1,3.8,0.2,-5.2,5.6,-0.9,-4.5,-5.4,1,-5.3,-2.4,3.5,3.2,0,2.9,3.2,-6.3
Hydration free energy (ROBB790101),-1,0.3,-0.7,-1.2,2.1,-0.1,-0.7,0.3,1.1,4,2,-0.9,1.8,2.8,0.4,-1.2,-0.5,3,2.1,1.4
Mean area buried on transfer (ROSG850101),86.6,162.2,103.3,97.8,132.3,119.2,113.9,62.9,155.8,158,164.1,115.5,172.9,194.1,92.9,85.6,106.5,224.6,177.7,141
Mean fractional area loss (ROSG850102),0.74,0.64,0.63,0.62,0.91,0.62,0.62,0.72,0.78,0.88,0.85,0.52,0.85,0.88,0.64,0.66,0.7,0.85,0.76,0.86
"Side chain hydropathy, uncorrected for solvation (ROSM880101)",-0.67,12.1,7.23,8.72,-0.34,6.39,7.35,0,3.82,-3.02,-3.02,6.13,-1.3,-3.24,-1.75,4.35,3.86,-2.86,0.98,-2.18
"Side chain hydropathy, corrected for solvation (ROSM880102)",-0.67,3.89,2.27,1.57,-2,2.12,1.78,0,1.09,-3.02,-3.02,2.46,-1.67,-3.24,-1.75,0.1,-0.42,-2.86,0.98,-2.18
Loss of Side chain hydropathy by helix formation (ROSM880103),0.4,0.3,0.9,0.8,0.5,0.7,1.3,0,1,0.4,0.6,0.4,0.3,0.7,0.9,0.4,0.4,0.6,1.2,0.4
"Transfer free energy (Simon, 1976), Cited by Charton-Charton (SIMZ760101)",0.73,0.73,-0.01,0.54,0.7,-0.1,0.55,0,1.1,2.97,2.49,1.5,1.3,2.65,2.6,0.04,0.44,3,2.97,1.69
Principal component I (SNEP660101),0.239,0.211,0.249,0.171,0.22,0.26,0.187,0.16,0.205,0.273,0.281,0.228,0.253,0.234,0.165,0.236,0.213,0.183,0.193,0.255
Principal component II (SNEP660102),0.33,-0.176,-0.233,-0.371,0.074,-0.254,-0.409,0.37,-0.078,0.149,0.129,-0.075,-0.092,-0.011,0.37,0.022,0.136,-0.011,-0.138,0.245
Principal component III (SNEP660103),-0.11,0.079,-0.136,-0.285,-0.184,-0.067,-0.246,-0.073,0.32,0.001,-0.008,0.049,-0.041,0.438,-0.016,-0.153,-0.208,0.493,0.381,-0.155
Principal component IV (SNEP660104),-0.062,-0.167,0.166,-0.079,0.38,-0.025,-0.184,-0.017,0.056,-0.309,-0.264,-0.371,0.077,0.074,-0.036,0.47,0.348,0.05,0.22,-0.212
Zimm-Bragg parameter s at 20 C (SUEM840101),1.071,1.033,0.784,0.68,0.922,0.977,0.97,0.591,0.85,1.14,1.14,0.939,1.2,1.086,0.659,0.76,0.817,1.107,1.02,0.95
Zimm-Bragg parameter sigma x 1.0E4 (SUEM840102),8,0.1,0.1,70,26,33,6,0.1,0.1,55,33,1,54,18,42,0.1,0.1,77,66,0.1
Optimal matching hydrophobicity (SWER830101),-0.4,-0.59,-0.92,-1.31,0.17,-0.91,-1.22,-0.67,-0.64,1.25,1.22,-0.67,1.02,1.92,-0.49,-0.55,-0.28,0.5,1.67,0.91
Normalized frequency of alpha-helix (TANS770101),1.42,1.06,0.71,1.01,0.73,1.02,1.63,0.5,1.2,1.12,1.29,1.24,1.21,1.16,0.65,0.71,0.78,1.05,0.67,0.99
Normalized frequency of isolated helix (TANS770102),0.946,1.128,0.432,1.311,0.481,1.615,0.698,0.36,2.168,1.283,1.192,1.203,0,0.963,2.093,0.523,1.961,1.925,0.802,0.409
Normalized frequency of extended structure (TANS770103),0.79,1.087,0.832,0.53,1.268,1.038,0.643,0.725,0.864,1.361,1.111,0.735,1.092,1.052,1.249,1.093,1.214,1.114,1.34,1.428
Normalized frequency of chain reversal R (TANS770104),1.194,0.795,0.659,1.056,0.678,1.29,0.928,1.015,0.611,0.603,0.595,1.06,0.831,0.377,3.159,1.444,1.172,0.452,0.816,0.64
Normalized frequency of chain reversal S (TANS770105),0.497,0.677,2.072,1.498,1.348,0.711,0.651,1.848,1.474,0.471,0.656,0.932,0.425,1.348,0.179,1.151,0.749,1.283,1.283,0.654
Normalized frequency of chain reversal D (TANS770106),0.937,1.725,1.08,1.64,1.004,1.078,0.679,0.901,1.085,0.178,0.808,1.254,0.886,0.803,0.748,1.145,1.487,0.803,1.227,0.625
Normalized frequency of left-handed helix (TANS770107),0.289,1.38,3.169,0.917,1.767,2.372,0.285,4.259,1.061,0.262,0,1.288,0,0.393,0,0.16,0.218,0,0.654,0.167
Normalized frequency of zeta R (TANS770108),0.328,2.088,1.498,3.379,0,0,0,0.5,1.204,2.078,0.414,0.835,0.982,1.336,0.415,1.089,1.732,1.781,0,0.946
Normalized frequency of coil (TANS770109),0.945,0.364,1.202,1.315,0.932,0.704,1.014,2.355,0.525,0.673,0.758,0.947,1.028,0.622,0.579,1.14,0.863,0.777,0.907,0.561
Normalized frequency of chain reversal (TANS770110),0.842,0.936,1.352,1.366,1.032,0.998,0.758,1.349,1.079,0.459,0.665,1.045,0.668,0.881,1.385,1.257,1.055,0.881,1.101,0.643
Relative population of conformational state A (VASM830101),0.135,0.296,0.196,0.289,0.159,0.236,0.184,0.051,0.223,0.173,0.215,0.17,0.239,0.087,0.151,0.01,0.1,0.166,0.066,0.285
Relative population of conformational state C (VASM830102),0.507,0.459,0.287,0.223,0.592,0.383,0.445,0.39,0.31,0.111,0.619,0.559,0.431,0.077,0.739,0.689,0.785,0.16,0.06,0.356
Relative population of conformational state E (VASM830103),0.159,0.194,0.385,0.283,0.187,0.236,0.206,0.049,0.233,0.581,0.083,0.159,0.198,0.682,0.366,0.15,0.074,0.463,0.737,0.301
Electron-ion interaction potential (VELV850101),0.03731,0.09593,0.00359,0.1263,0.08292,0.07606,0.0058,0.00499,0.02415,0,0,0.0371,0.08226,0.0946,0.01979,0.08292,0.09408,0.05481,0.05159,0.00569
Bitterness (VENT840101),0,0,0,0,0,0,0,0,0,1,1,0,0,1,0,0,0,1,1,1
Transfer free energy to lipophilic phase (VHEG790101),-12.04,39.23,4.25,23.22,3.95,2.16,16.81,-7.85,6.28,-18.32,-17.79,9.71,-8.86,-21.98,5.82,-1.54,-4.15,-16.19,-1.51,-16.22
Average interactions per side chain atom (WARP780101),10.04,6.18,5.63,5.76,8.89,5.41,5.37,7.99,7.49,8.72,8.79,4.4,9.15,7.98,7.79,7.08,7,8.07,6.9,8.88
RF value in high salt chromatography (WEBA780101),0.89,0.88,0.89,0.87,0.85,0.82,0.84,0.92,0.83,0.76,0.73,0.97,0.74,0.52,0.82,0.96,0.92,0.2,0.49,0.85
Propensity to be buried inside (WERD780101),0.52,0.49,0.42,0.37,0.83,0.35,0.38,0.41,0.7,0.79,0.77,0.31,0.76,0.87,0.35,0.49,0.38,0.86,0.64,0.72
Free energy change of epsilon(i) to epsilon(ex) (WERD780102),0.16,-0.2,1.03,-0.24,-0.12,-0.55,-0.45,-0.16,-0.18,-0.19,-0.44,-0.12,-0.79,-0.25,-0.59,-0.01,0.05,-0.33,-0.42,-0.46
Free energy change of alpha(Ri) to alpha(Rh) (WERD780103),0.15,-0.37,0.69,-0.22,-0.19,-0.06,0.14,0.36,-0.25,0.02,0.06,-0.16,0.11,1.18,0.11,0.13,0.28,-0.12,0.19,-0.08
Free energy change of epsilon(i) to alpha(Rh) (WERD780104),-0.07,-0.4,-0.57,-0.8,0.17,-0.26,-0.63,0.27,-0.49,0.06,-0.17,-0.45,0.03,0.4,-0.47,-0.11,0.09,-0.61,-0.61,-0.11
Polar requirement (WOEC730101),7,9.1,10,13,5.5,8.6,12.5,7.9,8.4,4.9,4.9,10.1,5.3,5,6.6,7.5,6.6,5.3,5.7,5.6
Hydration potential (WOLR810101),1.94,-19.92,-9.68,-10.95,-1.24,-9.38,-10.2,2.39,-10.27,2.15,2.28,-9.52,-1.48,-0.76,-3.68,-5.06,-4.88,-5.88,-6.11,1.99
Principal property value z1 (WOLS870101),0.07,2.88,3.22,3.64,0.71,2.18,3.08,2.23,2.41,-4.44,-4.19,2.84,-2.49,-4.92,-1.22,1.96,0.92,-4.75,-1.39,-2.69
Principal property value z2 (WOLS870102),-1.73,2.52,1.45,1.13,-0.97,0.53,0.39,-5.36,1.74,-1.68,-1.03,1.41,-0.27,1.3,0.88,-1.63,-2.09,3.65,2.32,-2.53
Principal property value z3 (WOLS870103),0.09,-3.44,0.84,2.36,4.13,-1.14,-0.07,0.3,1.11,-1.03,-0.98,-3.14,-0.41,0.45,2.23,0.57,-1.4,0.85,0.01,-1.29
"Unfolding Gibbs energy in water, pH7.0 (YUTK870101)",8.5,0,8.2,8.5,11,6.3,8.8,7.1,10.1,16.8,15,7.9,13.3,11.2,8.2,7.4,8.8,9.9,8.8,12
"Unfolding Gibbs energy in water, pH9.0 (YUTK870102)",6.8,0,6.2,7,8.3,8.5,4.9,6.4,9.2,10,12.2,7.5,8.4,8.3,6.9,8,7,5.7,6.8,9.4
"Activation Gibbs energy of unfolding, pH7.0 (YUTK870103)",18.08,0,17.47,17.36,18.17,17.93,18.16,18.24,18.49,18.62,18.6,17.96,18.11,17.3,18.16,17.57,17.54,17.19,17.99,18.3
"Activation Gibbs energy of unfolding, pH9.0 (YUTK870104)",18.56,0,18.24,17.94,17.84,18.51,17.97,18.57,18.64,19.21,19.01,18.36,18.49,17.95,18.77,18.06,17.71,16.87,18.23,18.98
